oyezId,volume,page,year,caseTitle,oldCite,usCite,dateDecision,docket,term,termId,issue,datesArgued,daysArgument,votesPetitioner,votesRespondent,advocateName,advocateRole,pdfSource,urlOyez
61339,385,458,1967,Lassen v. Arizona ex rel. Arizona Highway Dept.,0,385 U.S. 458,1967-01-10,84,1966,1966-10,federal-state ownership dispute (cf. Submerged Lands Act),1966-11-16,1,9,0,Rex E. Lee,0,loc,"https://www.oyez.org/cases/1966/84"
61896,397,137,1970,"Pike v. Bruce Church, Inc.",0,397 U.S. 137,1970-03-02,301,1969,1969-10,"state or local government regulation, especially of business (cf. federal pre-emption of state court jurisdiction, federal pre-emption of state legislation or regulation)",1970-01-13,1,0,8,Rex E. Lee,0,loc,"https://www.oyez.org/cases/1969/301"
61826,399,204,1970,City of Phoenix v. Kolodziejski,0,399 U.S. 204,1970-06-23,1066,1969,1969-10,voting,1970-03-31,1,3,5,Rex E. Lee,0,loc,"https://www.oyez.org/cases/1969/1066"
51480,425,840,1976,Chandler v. Roudebush,0,425 U.S. 840,1976-06-01,74-1599,1975,1975-10,"employment discrimination: on basis of race, age, religion, illegitimacy, national origin, or working conditions.",1976-03-02,1,9,0,Rex E. Lee,0,loc,"https://www.oyez.org/cases/1975/74-1599"
51680,429,181,1976,Mathews v. De Castro,0,429 U.S. 181,1976-12-13,75-1197,1976,1976-10,sex discrimination (excluding sex discrimination in employment),1976-11-08,1,9,0,Rex E. Lee,0,loc,"https://www.oyez.org/cases/1976/75-1197"
52029,442,289,1979,Babbitt v. United Farm Workers National Union,0,442 U.S. 289,1979-06-05,78-225,1978,1978-10,"comity: First Amendment",1979-02-21,1,7,2,Rex E. Lee,0,loc,"https://www.oyez.org/cases/1978/78-225"
52334,451,355,1981,Ball v. James,0,451 U.S. 355,1981-04-29,79-1740,1980,1980-10,"reapportionment: other than plans governed by the Voting Rights Act",1981-02-23,1,5,4,Rex E. Lee,0,loc,"https://www.oyez.org/cases/1980/79-1740"
52352,453,654,1981,Dames & Moore v. Regan,0,453 U.S. 654,1981-07-02,80-2078,1980,1980-10,"due process: takings clause, or other non-constitutional governmental taking of property",1981-06-24,1,1,8,Rex E. Lee,0,loc,"https://www.oyez.org/cases/1980/80-2078"
52392,454,139,1981,Weinberger v. Catholic Action of Hawaii/Peace Education Project,0,454 U.S. 139,1981-12-01,81-1377,1981,1981-10,Freedom of Information Act and related federal or state statutes or regulations,1981-10-13,1,9,0,Rex E. Lee,0,loc,"https://www.oyez.org/cases/1981/81-1377"
52462,454,464,1982,"Valley Forge Christian College v. Americans United for Separation of Church and State, Inc.",0,454 U.S. 464,1982-01-12,80-327,1981,1981-10,"standing to sue: taxpayer's suit",1981-11-04,1,5,4,Rex E. Lee,0,loc,"https://www.oyez.org/cases/1981/80-327"
52549,456,512,1982,North Haven Bd. of Educ. v. Bell,0,456 U.S. 512,1982-05-17,80-986,1981,1981-10,sex discrimination in employment (cf. sex discrimination),1981-12-09,1,3,6,Rex E. Lee,0,loc,"https://www.oyez.org/cases/1981/80-986"
52560,456,742,1982,FERC v. Mississippi,0,456 U.S. 742,1982-06-01,80-1749,1981,1981-10,"national supremacy: public utilities (cf. federal public utilities regulation)",1982-01-19,1,5,4,Rex E. Lee,0,loc,"https://www.oyez.org/cases/1981/80-1749"
52537,462,919,1983,INS v. Chadha,0,462 U.S. 919,1983-06-23,80-1832,1981,1981-10,legislative veto,"1982-02-22,1982-12-07",2,2,7,Rex E. Lee,0,loc,"https://www.oyez.org/cases/1981/80-1832"
52396,458,527,1982,Crawford v. Board of Education of City of Los Angeles,0,458 U.S. 527,1982-06-30,81-38,1981,1981-10,"desegregation, schools",1982-03-22,1,1,8,Rex E. Lee,0,loc,"https://www.oyez.org/cases/1981/81-38"
52530,458,50,1982,Northern Pipeline Constr. Company v. Marathon Pipe Line Company,0,458 U.S. 50,1982-06-28,81-150,1981,1981-10,"judicial administration: jurisdiction or authority of federal district courts or territorial courts",1982-04-27,1,3,6,Rex E. Lee,0,loc,"https://www.oyez.org/cases/1981/81-150"
52595,460,226,1983,Equal Employment Opportunity Commission v. Wyoming,0,460 U.S. 226,1983-03-02,81-554,1982,1982-10,"employment discrimination: on basis of race, age, religion, illegitimacy, national origin, or working conditions.",1982-10-05,1,5,4,Rex E. Lee,0,loc,"https://www.oyez.org/cases/1982/81-554"
52724,462,213,1983,IIllinois v. Gates,0,462 U.S. 213,1983-06-08,81-430,1982,1982-10,search and seizure (other than as pertains to vehicles or Crime Control Act),"1982-10-13,1983-03-01",2,6,3,Rex E. Lee,0,loc,"https://www.oyez.org/cases/1982/81-430"
52721,460,370,1983,Hillsboro Nat'l Bank v. Commissioner,0,460 U.S. 370,1983-03-07,81-485,1982,1982-10,"federal taxation, typically under provisions of the Internal Revenue Code",1982-11-01,1,7,2,Rex E. Lee,0,loc,"https://www.oyez.org/cases/1982/81-485"
52672,462,416,1983,Akron v. Akron Center For Reproductive Health,0,462 U.S. 416,1983-06-15,81-746,1982,1982-10,"abortion: including contraceptives",1982-11-30,1,3,6,Rex E. Lee,0,loc,"https://www.oyez.org/cases/1982/81-746"
52743,461,171,1983,United States v. Grace,0,461 U.S. 171,1983-04-20,81-1863,1982,1982-10,"First Amendment, miscellaneous (cf. comity: First Amendment)",1983-01-18,1,0,9,Rex E. Lee,0,loc,"https://www.oyez.org/cases/1982/81-1863"
52571,461,540,1983,Regan v. Taxation With Representation of Washington,0,461 U.S. 540,1983-05-23,81-2338,1982,1982-10,"First Amendment, miscellaneous (cf. comity: First Amendment)",1983-03-22,1,9,0,Rex E. Lee,0,loc,"https://www.oyez.org/cases/1982/81-2338"
52636,463,29,1983,"Motor Vehicle Manufacturers Association of the United States, Inc. v. State Farm Mutual Automobile Insurance Company",0,463 U.S. 29,1983-06-24,82-354,1982,1982-10,judicial review of administrative agency's or administrative official's actions and procedures,1983-04-26,1,9,0,Rex E. Lee,0,loc,"https://www.oyez.org/cases/1982/82-354"
52880,465,668,1984,Lynch v. Donnelly,0,465 U.S. 668,1984-03-05,82-1256,1983,1983-10,"establishment of religion (other than as pertains to parochiaid:)",1983-10-04,1,5,4,Rex E. Lee,0,loc,"https://www.oyez.org/cases/1983/82-1256"
52897,464,312,1984,Secretary of the Interior v. California,0,464 U.S. 312,1984-01-11,82-1326,1983,1983-10,"natural resources - environmental protection (cf. national supremacy: natural resources, national supremacy: pollution)",1983-11-01,1,5,4,Rex E. Lee,0,loc,"https://www.oyez.org/cases/1983/82-1326"
52894,467,561,1984,Firefighters Local Union No. 1784 v. Stotts,0,467 U.S. 561,1984-06-12,82-206,1983,1983-10,affirmative action,1983-12-06,1,6,3,Rex E. Lee,0,loc,"https://www.oyez.org/cases/1983/82-206"
52854,468,897,1984,United States v. Leon,0,468 U.S. 897,1984-07-05,82-1771,1983,1983-10,search and seizure (other than as pertains to vehicles or Crime Control Act),1984-01-17,1,6,3,Rex E. Lee,0,loc,"https://www.oyez.org/cases/1983/82-1771"
52926,468,737,1984,Allen v. Wright,0,468 U.S. 737,1984-07-03,81-757,1983,1983-10,"standing to sue: personal injury",1984-02-29,1,5,3,Rex E. Lee,0,loc,"https://www.oyez.org/cases/1983/81-757"
52783,469,528,1985,Garcia v. San Antonio Metro. Transit Authority,0,469 U.S. 528,1985-02-19,82-1913,1983,1983-10,Fair Labor Standards Act,"1984-03-19,1984-10-01",2,5,4,Rex E. Lee,0,loc,"https://www.oyez.org/cases/1983/82-1913"
52770,468,85,1984,National Collegiate Athletic Association v. Board of Regents of the University of Oklahoma,0,468 U.S. 85,1984-06-27,83-271,1983,1983-10,antitrust (except in the context of mergers and union antitrust),1984-03-20,1,2,7,Rex E. Lee,0,loc,"https://www.oyez.org/cases/1983/83-271"
52781,468,841,1984,Selective Service System v. Minnesota Public Interest Research Group,0,468 U.S. 841,1984-07-05,83-276,1983,1983-10,self-incrimination (other than as pertains to Miranda or immunity from prosecution),1984-04-23,1,6,2,Rex E. Lee,0,loc,"https://www.oyez.org/cases/1983/83-276"
52984,470,598,1985,Wayte v. United States,0,470 U.S. 598,1985-03-19,83-1292,1984,1984-10,conscientious objectors (cf. military draftee or military active duty) to military service,1984-11-06,1,2,7,Rex E. Lee,0,loc,"https://www.oyez.org/cases/1984/83-1292"
53027,473,402,1985,Aguilar v. Felton,0,473 U.S. 402,1985-07-01,84-237,1984,1984-10,"parochiaid: government aid to religious schools, or religious requirements in public schools",1984-12-05,1,4,5,Rex E. Lee,0,loc,"https://www.oyez.org/cases/1984/84-237"
52956,472,181,1985,Lowe v. Securities and Exchange Commission,0,472 U.S. 181,1985-06-10,83-1911,1984,1984-10,"natural resources - environmental protection (cf. national supremacy: natural resources, national supremacy: pollution)",1985-01-07,1,8,0,Rex E. Lee,0,loc,"https://www.oyez.org/cases/1984/83-1911"
52930,473,788,1985,"Cornelius v. NAACP Legal Defense and Educational Fund, Inc.",0,473 U.S. 788,1985-07-02,84-312,1984,1984-10,"First Amendment, miscellaneous (cf. comity: First Amendment)",1985-02-19,1,4,3,Rex E. Lee,0,loc,"https://www.oyez.org/cases/1984/84-312"
53083,472,846,1985,Jean v. Nelson,0,472 U.S. 846,1985-06-26,84-5240,1984,1984-10,"judicial administration: jurisdiction or authority of federal courts of appeals",1985-03-25,1,2,6,Rex E. Lee,0,loc,"https://www.oyez.org/cases/1984/84-5240"
53039,472,159,1985,"Northeast Bancorp, Inc. v. Board of Governors of the Federal Reserve System",0,472 U.S. 159,1985-06-10,84-363,1984,1984-10,mergers,1985-04-15,1,0,8,Rex E. Lee,0,loc,"https://www.oyez.org/cases/1984/84-363"
53017,472,353,1985,Johnson v. Mayor and City Council of Baltimore,0,472 U.S. 353,1985-06-17,84-518,1984,1984-10,"employment discrimination: on basis of race, age, religion, illegitimacy, national origin, or working conditions.",1985-04-22,1,9,0,Rex E. Lee,0,loc,"https://www.oyez.org/cases/1984/84-518"
53182,475,643,1986,"AT&T Technologies, Inc. v. Communications Workers of America",0,475 U.S. 643,1986-04-07,84-1913,1985,1985-10,arbitration (in the context of labor-management or employer-employee relations) (cf. arbitration),1986-01-22,1,9,0,Rex E. Lee,0,loc,"https://www.oyez.org/cases/1985/84-1913"
53129,476,953,1986,Nantahala Power & Light Company v. Thornburg,0,476 U.S. 953,1986-06-16,85-568,1985,1985-10,federal pre-emption of state legislation or regulation. cf. state regulation of business. rarely involves union activity. Does not involve constitutional interpretation unless the Court says it does.,1986-04-21,1,7,0,Rex E. Lee,0,loc,"https://www.oyez.org/cases/1985/85-568"
53433,479,130,1986,"R. J. Reynolds Tobacco Company v. Durham County, North Carolina",0,479 U.S. 130,1986-12-09,85-1021,1986,1986-10,state or local government tax,1986-10-06,1,0,9,Rex E. Lee,0,loc,"https://www.oyez.org/cases/1986/85-1021"
53361,480,470,1987,Keystone Bituminous Coal Association. v. DeBenedictis,0,480 U.S. 470,1987-03-09,85-1092,1986,1986-10,"due process: takings clause, or other non-constitutional governmental taking of property",1986-11-10,1,4,5,Rex E. Lee,0,loc,"https://www.oyez.org/cases/1986/85-1092"
53351,480,557,1987,"Atchison, Topeka & Santa Fe Railway Company v. Buell",0,480 U.S. 557,1987-03-24,85-1140,1986,1986-10,"election of remedies: legal remedies available to injured persons or things",1986-12-01,1,0,9,Rex E. Lee,0,loc,"https://www.oyez.org/cases/1986/85-1140"
53302,481,429,1987,Burlington Northern Railroad Company v. Brotherhood of Maintenance of Way Employes,0,481 U.S. 429,1987-04-28,86-39,1986,1986-10,"labor-management disputes: secondary activity",1987-02-23,1,0,9,Rex E. Lee,0,loc,"https://www.oyez.org/cases/1986/86-39"
53410,483,327,1987,Corporation of the Presiding Bishop of the Church of Jesus Christ of Latter-Day Saints v. Amos,0,483 U.S. 327,1987-06-24,86-179,1986,1986-10,"establishment of religion (other than as pertains to parochiaid:)",1987-03-31,1,9,0,Rex E. Lee,0,loc,"https://www.oyez.org/cases/1986/86-179"
53299,483,27,1987,"Citicorp Industrial Credit, Inc. v. Brock",0,483 U.S. 27,1987-06-22,86-88,1986,1986-10,Fair Labor Standards Act,1987-04-20,1,2,7,Rex E. Lee,0,loc,"https://www.oyez.org/cases/1986/86-88"
53450,484,72,1987,Karcher v. May,0,484 U.S. 72,1987-12-01,85-1551,1987,1987-10,"standing to sue: personal injury",1987-10-06,1,0,8,Rex E. Lee,0,loc,"https://www.oyez.org/cases/1987/85-1551"
62193,487,354,1988,Mississippi Power & Light Company v. Mississippi ex rel. Moore,0,487 U.S. 354,1988-06-24,86-1970,1987,1987-10,"federal and some few state regulation of public utilities regulation: nuclear power",1988-02-22,1,3,6,Rex E. Lee,0,loc,"https://www.oyez.org/cases/1987/86-1970"
53644,488,179,1988,National Collegiate Athletic Association v. Tarkanian,0,488 U.S. 179,1988-12-12,87-1061,1988,1988-10,"due process: hearing, government employees",1988-10-05,1,5,4,Rex E. Lee,0,loc,"https://www.oyez.org/cases/1988/87-1061"
53667,491,350,1989,"New Orleans Public Service, Inc. v. Council of the City of New Orleans",0,491 U.S. 350,1989-06-19,88-348,1988,1988-10,"comity primarily removal cases, civil procedure (cf. comity, criminal and First Amendment); deference to foreign judicial tribunals",1989-04-25,1,9,0,Rex E. Lee,0,loc,"https://www.oyez.org/cases/1988/88-348"
53796,493,182,1990,University of Pennsylvania v. Equal Employment Opportunity Commission,0,493 U.S. 182,1990-01-09,88-493,1989,1989-10,"First Amendment, miscellaneous (cf. comity: First Amendment)",1989-11-07,1,0,9,Rex E. Lee,0,loc,"https://www.oyez.org/cases/1989/88-493"
53753,495,271,1990,California v. American Stores Company,0,495 U.S. 271,1990-04-30,89-258,1989,1989-10,mergers,1990-01-16,1,9,0,Rex E. Lee,0,loc,"https://www.oyez.org/cases/1989/89-258"
53759,495,472,1990,Davis v. United States,0,495 U.S. 472,1990-05-21,89-98,1989,1989-10,"federal taxation of gifts, personal, business, or professional expenses",1990-03-26,1,0,9,Rex E. Lee,0,loc,"https://www.oyez.org/cases/1989/89-98"
53880,498,211,1991,"Mobil Oil Exploration & Producing Southeast, Inc. v. United Distribution Companies",0,498 U.S. 211,1991-01-08,89-1452,1990,1990-10,judicial review of administrative agency's or administrative official's actions and procedures,1990-11-05,1,8,0,Rex E. Lee,0,loc,"https://www.oyez.org/cases/1990/89-1452"
53860,501,775,1991,Blatchford v. Native Village of Noatak,0,501 U.S. 775,1991-06-24,89-1782,1990,1990-10,"liability, governmental: tort or contract actions by or against government or governmental officials other than defense of criminal actions brought under a civil rights action.",1991-02-19,1,6,3,Rex E. Lee,0,loc,"https://www.oyez.org/cases/1990/89-1782"
54048,503,467,1992,Freeman v. Pitts,0,503 U.S. 467,1992-03-31,89-1290,1991,1991-10,"desegregation, schools",1991-10-07,1,8,0,Rex E. Lee,0,loc,"https://www.oyez.org/cases/1991/89-1290"
53946,505,1,1992,Nordlinger v. Hahn,0,505 U.S. 1,1992-06-18,90-1912,1991,1991-10,state or local government tax,1992-02-25,1,1,8,Rex E. Lee,0,loc,"https://www.oyez.org/cases/1991/90-1912"
54241,511,863,1994,"Digital Equipment Corporation v. Desktop Direct, Inc.",0,511 U.S. 863,1994-06-06,93-405,1993,1993-10,"judicial administration: review of non-final order",1994-02-22,1,0,9,Rex E. Lee,0,loc,"https://www.oyez.org/cases/1993/93-405"
54182,512,79,1994,O'Melveny & Myers v. Federal Deposit Insurance Corporation,0,512 U.S. 79,1994-06-13,93-489,1993,1993-10,federal pre-emption of state legislation or regulation. cf. state regulation of business. rarely involves union activity. Does not involve constitutional interpretation unless the Court says it does.,1994-03-21,1,9,0,Rex E. Lee,0,loc,"https://www.oyez.org/cases/1993/93-489"
