numberArgument,numberAdvocate,nameAdvocate,homeAdvocate,selfAdvocate,argsAdvocate,dateArgument,caseInfo,citeInfo,corrections
326,129,"Patricia Rosen","",false,1,"Mar. 1-2, 1977","Dixon v. Love (No. 75-1513), 431 U.S. 105 (1977)","1976 J. Sup. Ct. U.S. 464",""
327,130,"Louise Grumner","",false,1,"Mar. 21, 1977","Smith v. Org. of Foster Families for Equality & Reform (No. 76-180), 431 U.S. 816 (1977)","1976 J. Sup. Ct. U.S. 506-507",""
328,131,"Helen Buttenweiser","",false,1,"Mar. 21, 1977","Smith v. Org. of Foster Families for Equality & Reform (No. 76-180), 431 U.S. 816 (1977)","1976 J. Sup. Ct. U.S. 506-507",""
329,72,"Maria L. Marcus","",false,5,"Mar. 21, 1977","Smith v. Org. of Foster Families for Equality & Reform (No. 76-180), 431 U.S. 816 (1977)","1976 J. Sup. Ct. U.S. 506-507",""
330,132,"Marcia Robinson Lowry","",false,1,"Mar. 21, 1977","Smith v. Org. of Foster Families for Equality & Reform (No. 76-180), 431 U.S. 816 (1977)","1976 J. Sup. Ct. U.S. 506-507",""
331,112,"Judith A. Gordon","",false,2,"Mar. 22, 1977","Nyquist v. Mauclet (No. 76-208), 431 U.S. 1 (1977)","1976 J. Sup. Ct. U.S. 510",""
332,70,"Louise Korns","",false,5,"Mar. 28, 1977","Roberts v. Louisiana (No. 75-5206), 431 U.S. 633 (1977)","1976 J. Sup. Ct. U.S. 527",""
333,133,"Pamela S. Horowitz","",false,1,"Apr. 19, 1977","Dothard v. Rawlinson (No. 76-422), 433 U.S. 347 (1977)","1976 J. Sup. Ct. U.S. 572",""
334,134,"Gail P. Pigg","",false,1,"Apr. 26, 1977","Third National Bank in Nashville v. Impac Ltd., Inc. (No. 76-674), 431 U.S. 312 (1977)","1976 J. Sup. Ct. U.S. 590",""
335,62,"Jean M. Coon","",false,6,"Oct. 3, 1977","New York v. Cathedral Academy (No. 76-616), 434 U.S. 125 (1977)","1977 J. Sup. Ct. U.S. 125",""
336,135,"Mary C. Dunlap","",false,1,"Oct. 5, 1977","Richmond Unified School District v. Berg (No. 75-1069), 434 U.S. 158 (1977)","1977 J. Sup. Ct. U.S. 129",""
337,136,"Sharon L. King","",false,1,"Oct. 12, 1977","Central Illinois Public Service Co. v. US (No. 76-1058), 435 U.S. 21 (1978)","1977 J. Sup. Ct. U.S. 147",""
338,137,"Mary T. Matthies","",false,1,"Nov. 7, 1977","Shell Oil Co. v. Dart (No. 76-768), 434 U.S. 99 (1977)","1977 J. Sup. Ct. U.S. 217",""
339,112,"Judith A. Gordon","",false,3,"Nov. 8, 1977","Foley v. Connelie (No. 76-839), 435 U.S. 291 (1978)","1977 J. Sup. Ct. U.S. 215",""
340,138,"Sara S. Beale","",false,1,"Jan. 11, 1978","U.S. v. Culbert (No. 77-142), 435 U.S. 371 (1978)","1977 J. Sup. Ct. U.S. 355",""
341,139,"Suzie S. Thorn","",false,1,"Mar. 29, 1978","Kulko v. Superior Court of California (No. 77-293), 436 U.S. 84 (1978)","1977 J. Sup. Ct. U.S. 555-556",""
342,140,"Patricia M. Wald","",false,1,"Apr. 17, 1978","Penn Central Transportation v. City of New York (No. 77-444), 438 U.S. 104 (1978)","1977 J. Sup. Ct. U.S. 604",""
343,138,"Sara S. Beale","",false,2,"Apr. 18, 1978","Andrus v. Charlestone Stone Products (No. 77-380), 436 U.S. 604 (1978)","1977 J. Sup. Ct. U.S. 608",""
344,141,"Carol Los Mansmann","",false,1,"Oct. 3, 1978","Colautti v. Franklin (No. 77-891), 439 U.S. 379 (1979)","1978 J. Sup. Ct. U.S. 131",""
345,142,"Kathleen M. Cummins","",false,1,"Oct. 4, 1978","Michigan v. Doran (No. 77-1202), 439 U.S. 282 (1978)","1978 J. Sup. Ct. U.S. 133",""
346,72,"Maria L. Marcus","",false,6,"Oct. 30, 1978","New York Telephone Co. v. New York Dep't of Labor (No. 77-961), 440 U.S. 519 (1979)","1978 J. Sup. Ct. U.S. 201","aka Maria Lenhoff Marcus"
347,143,"Elinor H. Stillman","",false,1,"Nov. 1, 1978","Hisquierdo v. Hisquierdo (No. 77-533), 439 U.S. 572 (1979)","1978 J. Sup. Ct. U.S. 205",""
348,144,"Herma Hill Kay","",false,1,"Nov. 1, 1978","Hisquierdo v. Hisquierdo (No. 77-533), 439 U.S. 572 (1979)","1978 J. Sup. Ct. U.S. 205",""
349,92,"Ruth B. Ginsburg","",false,6,"Nov. 1, 1978","Duren v. Missouri (No. 77-6067), 439 U.S. 357 (1979)","1978 J. Sup. Ct. U.S. 205",""
350,145,"Nanette Laughrey","",false,1,"Nov. 1, 1978","Duren v. Missouri (No. 77-6067), 439 U.S. 357 (1979)","1978 J. Sup. Ct. U.S. 205",""
351,146,"Dorothy Prengler","",false,1,"Nov. 8, 1978","Friedman v. Rogers (No. 77-1186), 440 U.S. 1 (1979)","1978 J. Sup. Ct. U.S. 227",""
352,147,"Barbara Ann Babcock","",false,1,"Nov. 8, 1978","Chrysler v. Brown (No. 77-922), 441 U.S. 281 (1979)","1978 J. Sup. Ct. U.S. 227",""
353,148,"Zona F. Hostetler","",false,1,"Nov. 27, 1978","Vance v. Bradley (No. 77-1254), 440 U.S. 93 (1979)","1978 J. Sup. Ct. U.S. 275",""
354,149,"Martha L. Boston","",false,1,"Nov. 28, 1978","Addington v. Texas (No. 77-5992), 441 U.S. 418 (1979)","1978 J. Sup. Ct. U.S. 277",""
355,116,"Barbara A.H. Smith","",false,2,"Nov. 28, 1978","Massachusetts v. White (No. 77-1388), 439 U.S. 280 (1978)","1978 J. Sup. Ct. U.S. 277",""
356,150,"Gerri Papushkewyc h","",false,1,"Dec. 4, 1978","Scott v. Illinois (No. 77-1177), 440 U.S. 367 (1979)","1978 J. Sup. Ct. U.S. 294",""
357,138,"Sara S. Beale","",false,3,"Dec. 5, 1978","Douglas Oil Co. v. Petrol Stops Northwest (No. 77-1547), 441 U.S. 211 (1979)","1978 J. Sup. Ct. U.S. 296",""
358,151,"Joan Offner","",false,1,"Dec. 6, 1978","New York City Transit v. Beazer (No. 77-1427), 440 U.S. 568 (1979)","1978 J. Sup. Ct. U.S. 297",""
359,104,"Deborah M. Greenberg","",false,2,"Dec. 6, 1978","New York City Transit v. Beazer (No. 77-1427), 440 U.S. 568 (1979)","1978 J. Sup. Ct. U.S. 297",""
360,112,"Judith A. Gordon","",false,4,"Jan. 10, 1979","Ambach v. Norwick (No. 76-808), 441 U.S. 68 (1979)","1978 J. Sup. Ct. U.S. 359",""
361,152,"Amalya L. Kearse","",false,1,"Jan. 15, 1979","Broadcast Music, Inc. v. CBS, Inc. (No. 77-1578), 441 U.S. 1 (1979)","1978 J. Sup. Ct. U.S. 378",""
362,138,"Sara S. Beale","",false,4,"Jan. 16, 1979","Leo Sheep Co. v. U.S. (No. 77-1686), 440 U.S. 668 (1979)","1978 J. Sup. Ct. U.S. 380",""
363,73,"Phyllis Skloot Bamberger","",false,4,"Jan. 16, 1979","Bell v. Wolfish (No. 77-1829), 441 U.S. (1979)","1978 J. Sup. Ct. U.S. 380",""
364,70,"Louise Korns","",false,6,"Feb. 22 1979","Burch v. Louisiana (No. 78-90), 441 U.S. 130 (1979)","1978 J. Sup. Ct. U.S. 450",""
365,153,"Eileen Shapiro","",false,1,"Feb. 22, 1979","Ulster County Court v. Allen (No. 77-1554), 442 U.S. 140 (1979)","1978 J. Sup. Ct. U.S. 450",""
366,154,"Windell E.C. Porter","",false,1,"Feb. 26, 1979","Moore v. Sims (No. 78-6), 442 U.S. 415 (1979)","1978 J. Sup. Ct. U.S. 467",""
367,155,"Sana F. Shtasel","",false,1,"Feb. 27, 1979","Davis v. Passman (No. 78-5072), 442 U.S. 228 (1979)","1978 J. Sup. Ct. U.S. 469",""
368,138,"Sara S. Beale","",false,5,"Mar. 21, 1979","Wilson v. Omaha Indian Tribe (No. 78-160), 442 U.S. 653 (1979)","1978 J. Sup. Ct. U.S. 524",""
369,156,"Carolyn J. Colville","",false,1,"Mar. 21, 1979","Jackson v. Virginia (No. 78-5283), 443 U.S. 307 (1979)","1978 J. Sup. Ct. U.S. 524",""
370,114,"Amy Juviler","",false,2,"Apr. 18, 1979","Leroy v. Great Western United Corporation (No. 78-759), 443 U.S. 173 (1979)","1978 J. Sup. Ct. U.S. 598",""
371,157,"Wandaleen Poynter","",false,1,"Apr. 23, 1979","Southern Railway Co. v. Seaboard Allied Milling Corp. (No. 78-604), 442 U.S. 444 (1979)","1978 J. Sup. Ct. U.S. 615",""
372,158,"Doris Peterson","",false,1,"Apr. 24, 1979","Stafford v. Briggs (No. 77-1546), 444 U.S. 527 (1979)","1978 J. Sup. Ct. U.S. 618",""
373,143,"Elinor H. Stillman","",false,2,"Apr. 24, 1979","Stafford v. Briggs (No. 77-1546), 444 U.S. 527 (1979)","1978 J. Sup. Ct. U.S. 618",""
374,96,"Harriet S. Shapiro","",false,8,"Apr. 25, 1979","Califano v. Boles (No. 78-808), 443 U.S. 282 (1979)","1978 J. Sup. Ct. U.S. 619",""
375,96,"Harriet S. Shapiro","",false,9,"Oct. 1, 1979","Andrus v. Allard (No. 78-740), 444 U.S. 51 (1979)","1979 J. Sup. Ct. U.S. 129",""
376,159,"Kathryn A. Oberly","",false,1,"Oct. 1, 1979","Kaiser Aetna v. United States (No. 78-738), 444 U.S. 164 (1979)","1979 J. Sup. Ct. U.S. 129",""
377,143,"Elinor H. Stillman","",false,3,"Oct. 3, 1979","U.S. v. Kubrick (No. 78-1014), 444 U.S. 111 (1979)","1979 J. Sup. Ct. U.S. 133",""
378,96,"Harriet S. Shapiro","",false,10,"Oct. 31, 1979","U.S. v. Clark (No. 78-1513), 445 U.S. 23 (1980)","1979 J. Sup. Ct. U.S. 201",""
379,158,"Doris Peterson","",false,2,"Nov. 7, 1979","Stafford v. Briggs (No. 77-1546), 444 U.S. 527 (1979)","1979 J. Sup. Ct. U.S. 225",""
380,143,"Elinor H. Stillman","",false,4,"Nov. 7, 1979","Stafford v. Briggs (No. 77-1546), 444 U.S. 527 (1979)","1979 J. Sup. Ct. U.S. 225",""
381,160,"Amy Loeserman Klein","",false,1,"Nov. 28, 1979","Seatrain Shipbuilding Corp. v. Shell Oil Co. (No. 78-1651), 444 U.S. 572 (1980)","1979 J. Sup. Ct. U.S. 294",""
382,161,"Joan E. Pilver","",false,1,"Jan. 9, 1980","Maher v. Gagne (No. 78-1888), 448 U.S. 122 (1980)","1979 J. Sup. Ct. U.S. 373",""
383,116,"Barbara A.H. Smith","",false,3,"Jan. 9, 1980","Massachusetts v. Meehan (No. 78-1874), 445 U.S. 39 (1980)","1979 J. Sup. Ct. U.S. 373",""
384,143,"Elinor H. Stillman","",false,5,"Jan. 14, 1980","White Mountain Apache Tribe v. Bracker (No. 78-1177), 448 U.S. 1980","1979 J. Sup. Ct. U.S. 390",""
385,162,"Maryann Walsh","",false,1,"Jan. 16, 1980","Harrison v. PPG Industries, Inc. (No. 78-1918), 446 U.S. 578 (1980)","1979 J. Sup. Ct. U.S. 393",""
386,96,"Harriet S. Shapiro","",false,11,"Feb. 19, 1980","New York Gaslight Club, Inc. v. Carey (No. 79-192), 447 U.S. 54 (1980)","1979 J. Sup. Ct. U.S. 458",""
387,163,"Ellen Broadman","",false,1,"Feb. 19, 1980","Supreme Court of Virginia v. Consumers Union of the United States, Inc. (No. 79-198), 446 U.S. 719 (1980)","1979 J. Sup. Ct. U.S. 459",""
388,164,"Marilyn J. Gelb","",false,1,"Feb. 20, 1980","Cuyler v. Sullivan (No. 78-1832), 446 U.S. 335 (1980)","1979 J. Sup. Ct. U.S. 463",""
389,165,"Joan B. Gottschall","",false,1,"Feb. 25, 1980","U.S. v. Raddatz (No. 79-8), 447 U.S. 667 (1980)","1979 J. Sup. Ct. U.S. 482",""
390,143,"Elinor H. Stillman","",false,6,"Mar. 18, 1980","PruneYard Shopping Center v. Robins (No. 79-289), 447 U.S. 74 (1980)","1979 J. Sup. Ct. U.S. 524",""
391,166,"Judith P. Vladeck","",false,1,"Mar. 25, 1980","Mohasco Corporation v. Silver (No. 79-616), 447 U.S. 807 (1980)","1979 J. Sup. Ct. U.S. 546",""
392,167,"Janet L. Cox","",false,1,"Mar. 26, 1980","Hicks v. Oklahoma (No. 78-6885), 447 U.S. 343 (1980)","1979 J. Sup. Ct. U.S. 547",""
393,168,"Ellen G. Robinson","",false,1,"Apr. 15, 1980","Carey v. Brown (No. 79-703), 447 U.S. 455 (1980)","1979 J. Sup. Ct. U.S. 600",""
394,96,"Harriet S. Shapiro","",false,12,"Apr. 15, 1980","Roadway Express, Inc. v. Piper (No. 79-701), 447 U.S. 752 (1980)","1979 J. Sup. Ct. U.S. 600",""
395,119,"Rhonda Copelon","",false,2,"Apr. 21, 1980","Harris v. McRae (No. 79-1268), 448 U.S. 297 (1980)","1979 J. Sup. Ct. U.S. 620",""
396,169,"Maria Parisi-Vickers","",false,1,"Oct. 7, 1980","Cuyler v. Adams (No. 78-1841), 449 U.S. 433 (1981)","1980 J. Sup. Ct. U.S. 97","name originally spelled Maria Parisi Vickers"
397,170,"Judith E. Harris","",false,1,"Oct. 7, 1980","Delaware State College v. Ricks (No. 79-839), 449 U.S. 250 (1980)","1980 J. Sup. Ct. U.S. 97",""
398,171,"Blanca Bianchi de la Torre","",false,1,"Oct. 7, 1980","Thomas v. Indiana Review Board (No. 79-952), 450 U.S. 707 (1981)","1980 J. Sup. Ct. U.S. 97",""
399,172,"Anita Ashton","",false,1,"Oct. 8, 1980","Estelle v. Smith (No. 79-1127), 451 U.S. 454 (1981)","1980 J. Sup. Ct. U.S. 99",""
400,143,"Elinor H. Stillman","",false,7,"Oct. 9, 1980","Potomac Electric Power Co. v. Workers' Compensation Program (No. 79-816), 449 U.S. 268 (1980)","1980 J. Sup. Ct. U.S. 99",""
401,173,"Kristin Booth Glen","",false,1,"Nov. 3, 1980","FCC v. WNCN Listeners Guild (No. 79-824), 450 U.S. 582 (1981)","1980 J. Sup. Ct. U.S. 166",""
402,174,"Wilhelmina Reuben Cooke","",false,1,"Nov. 3, 1980","FCC v. WNCN Listeners Guild (No. 79-824), 450 U.S. 582 (1981)","1980 J. Sup. Ct. U.S. 166",""
403,96,"Harriet S. Shapiro","",false,13,"Nov. 10, 1980","Universities Research Assn, Inc. v. Coutu (No. 78-1945), 450 U.S. 754 (1981)","1980 J. Sup. Ct. U.S. 184",""
404,143,"Elinor H. Stillman","",false,8,"Nov. 12, 1980","Delta Airlines v. August (No. 79-814), 450 U.S. 346 (1981)","1980 J. Sup. Ct. U.S. 185",""
405,175,"Susan M. Vance","",false,1,"Nov. 12, 1980","Delta Airlines v. August (No. 79-814), 450 U.S. 346 (1981)","1980 J. Sup. Ct. U.S. 185",""
406,176,"Barbara E. Etkind","",false,1,"Dec. 1, 1980","U.S. v Cortez (No. 79-404), 449 U.S. 411 (1981)","1980 J. Sup. Ct. U.S. 259",""
407,177,"Barbara Housman-Smith","",false,1,"Dec. 10, 1980","Kirchberg v. Feenstra (No. 79-1388), 450 U.S. 455 (1981)","1980 J. Sup. Ct. U.S. 281",""
408,178,"Regina M. Small","",false,1,"Jan. 12, 1981","Doe v. Delaware (No. 79-5932), 450 U.S. 382 (1981)","1980 J. Sup. Ct. U.S. 351",""
409,179,"Judith H. Mizner","",false,1,"Jan. 19, 1981","Albernaz v. U.S. (No. 79-1709), 450 U.S. 333 (1981)","1980 J. Sup. Ct. U.S. 372",""
410,143,"Elinor H. Stillman","",false,9,"Jan. 21, 1981","California v. Sierra Club (No. 79-1252), 451 U.S. 287 (1981)","1980 J. Sup. Ct. U.S. 377",""
411,180,"Jean P. Kemp","",false,1,"Mar. 2, 1981","Rhodes v. Chapman (No. 80-332), 452 U.S. 337 (1981)","1980 J. Sup. Ct. U.S. 466",""
412,181,"Carol A. Hewitt","",false,1,"Mar. 23, 1981","County of Washington v. Gunther (No. 80-429), 452 U.S. 161 (1981)","1980 J. Sup. Ct. U.S. 513",""
413,182,"Mary R. Carden","",false,1,"Mar. 23, 1981","Webb v. Webb (No. 79-6853), 451 U.S. 493 (1981)","1980 J. Sup. Ct. U.S. 513",""
414,183,"Patricia J. Barry","",false,1,"Mar. 31, 1981","Lehman v. Nakshian (No. 80-242), 453 U.S. 156 (1981)","1980 J. Sup. Ct. U.S. 537",""
415,176,"Barbara E. Etkind","",false,2,"Apr. 28, 1981","Howe v. Smith (No. 80-5392), 452 U.S. 473 (1981)","1980 J. Sup. Ct. U.S. 602",""
416,107,"Nancy Stearns","",false,2,"Oct. 13, 1981","Weinberger v. Catholic Action of Hawaii (No. 80-1377), 454 U.S. 139 (1981)","1981 J. Sup. Ct. U.S. 134",""
417,184,"Natalie E. West","",false,1,"Oct. 14, 1981","Citizens Against Rent Control v. Berkeley (No. 80-737), 454 U.S. 290 (1981)","1981 J. Sup. Ct. U.S. 135",""
418,185,"Mary S. Burdick","",false,1,"Nov. 3, 1981","Cabell v. Chavez-Salido (No. 80-990), 454 U.S. 432 (1982)","1981 J. Sup. Ct. U.S. 185",""
419,176,"Barbara E. Etkind","",false,3,"Nov. 10, 1981","Kaiser Steel Corp. v. Mullins (No. 80-1345) 455 U.S. 72 (1982)","1981 J. Sup. Ct. U.S. 209",""
420,186,"Vanessa Ruiz","",false,1,"Dec. 1, 1981","Havens Realty Corp. v. Coleman (No. 80-988), 455 U.S. 363 (1982)","1981 J. Sup. Ct. U.S. 264",""
421,187,"Martha A. Mills","",false,1,"Dec. 1, 1981","Lane v. Williams (No. 80-1240), 455 U.S. 624 (1982)","1981 J. Sup. Ct. U.S. 264",""
422,143,"Elinor H. Stillman","",false,10,"Dec. 2, 1981","Railway Labor Executives' Ass'n v. Gibbons (No. 80-415), 455 U.S. 457 (1982)","1981 J. Sup. Ct. U.S. 266",""
423,188,"Beverly J. Hodgson","",false,1,"Dec. 9, 1981","North Haven Bd. of Educ. v. Bell (No. 80-986), 456 U.S. 512 (1982)","1981 J. Sup. Ct. U.S. 283",""
424,189,"Sharon T. Nelson","",false,1,"Jan. 1, 1982","Federal Bureau of Investigation v. Abramson (No. 80-1735), 456 U.S. 615 (1982)","1981 J. Sup. Ct. U.S. 338",""
425,190,"Lola L. Bonner","",false,1,"Jan. 12, 1982","Mills v. Habluetzel (No. 80-6298), 456 U.S. 91 (1982)","1981 J. Sup. Ct. U.S. 340",""
426,191,"Elaine R. Jones","",false,1,"Jan. 19, 1982","Pullman-Standard v. Swint (No. 80-1190), 456 U.S. 273 (1982)","1981 J. Sup. Ct. U.S. 364",""
427,192,"Susan Gamble Smathers","",false,1,"Jan. 20, 1982","Florida Dep't of State v. Treasure Salvors, Inc. (No. 80-1924), 458 U.S. 670 (1982)","1981 J. Sup. Ct. U.S. 365",""
428,176,"Barbara E. Etkind","",false,4,"Feb. 22, 1982","Weinberger v. Rossi (No. 80-1924), 456 U.S. 25 (1982)","1981 J. Sup. Ct. U.S. 429",""
429,193,"Marie V. Driscoll","",false,1,"Feb. 22, 1982","Inwood Laboratories, Inc. v. Ives Laboratories (No. 81-11), 456 U.S. 844 (1982)","1981 J. Sup. Ct. U.S. 429",""
430,143,"Elinor H. Stillman","",false,11,"Feb. 23, 1982","Weinberger v. Romero-Barcelo (No. 80-1990), 456 U.S.305 (1982)","1981 J. Sup. Ct. U.S. 432",""
431,112,"Judith A. Gordon","",false,5,"Mar. 24, 1982","Blum v. Yaretzky (No. 80-1952), 457 U.S. 991 (1982)","1981 J. Sup. Ct. U.S. 506",""
432,96,"Harriet S. Shapiro","",false,14,"Mar. 30, 1982","California v. Grace Brethren Church (No. 81-455), 457 U.S. 393 (1982)","1981 J. Sup. Ct. U.S. 521",""
433,194,"Mary Ann Burges","",false,1,"Mar. 31, 1982","Middlesex County Ethics Committee v. Garden State Bar Association, 457 U.S. 423 (1982)","1981 J. Sup. Ct. U.S. 524",""
434,195,"Sarah E. Bennett","",false,1,"Apr. 19, 1982","F.W. Woolworth Co. v. Taxation & Revenue Dep't of New Mexico, 458 U.S. 354 (1982)","1981 J. Sup. Ct. U.S. 568",""
435,121,"Linda R. Hirshman","",false,2,"Apr. 21, 1982","Jackson Transit Authority v. Local Division 1285, Amalgamated Transit Union, AFL-CIO-CLC, 457 U.S. 15 (1982)","1981 J. Sup. Ct. U.S. 574",""
436,196,"Susan M. Jenkins","",false,1,"Apr. 27, 1982","Union Labor Life Ins. Co. v. Pireno (No. 81-389), 458 U.S. (1982)","1981 J. Sup. Ct. U.S. 594",""
437,176,"Barbara E. Etkind","",false,5,"Oct. 6, 1982","Bowen v. United States Postal Service, 459 U.S. 212 (1983)","1982 J. Sup. Ct. U.S. 95",""
438,197,"Linda K. Lager","",false,1,"Oct. 13, 1982","Connecticut v. Johnson, 460 U.S. 73 (1983)","1982 J. Sup. Ct. U.S. 120",""
439,176,"Barbara E. Etkind","",false,6,"Nov. 2, 1982","North Dakota v. United States, 460 U.S. 300 (1983)","1982 J. Sup. Ct. U.S. 167",""
440,198,"Robyn Greene","",false,1,"Nov. 3, 1982","United States v. Generix Drug Corporation, 460 U.S. 452 (1983)","1982 J. Sup. Ct. U.S. 169",""
441,199,"Harriet Lipkin","",false,1,"Nov. 9, 1982","Briscoe v. Lahue, 460 U.S. 325 (1983)","1982 J. Sup. Ct. U.S. 189",""
442,200,"Cheryl Helena Chapman","",false,1,"Nov. 10, 1982","Xerox Corporation v. County of Harris, 459 U.S. 145 (1982)","1982 J. Sup. Ct. U.S. 191",""
443,201,"Carolyn F. Corwin","",false,1,"Nov. 30, 1982","Lockheed Aircraft Corp. v. United States, 460 U.S. 190 (1983)","1982 J. Sup. Ct. U.S. 237",""
444,143,"Elinor H. Stillman","",false,12,"Dec. 1, 1982","Local 926, Int'l Union of Operating Engineers, AFL-CIO v. Jones, 460 U.S. 669 (1983)","1982 J. Sup. Ct. U.S. 239","aka Elinor Hadley Stillman"
445,202,"Deborah Bachrach","",false,1,"Jan. 10, 1983","Shaw v. Delta Airlines, 463 U.S. 85 (1983)","1982 J. Sup. Ct. U.S. 327-328",""
446,203,"Barbara D. Underwood","",false,1,"Feb. 22, 1983","Jones v. Barnes, 463 U.S. 745 (1983)","1982 J. Sup. Ct. U.S. 414",""
447,105,"Sheila M. Ginsberg","",false,3,"Feb. 22, 1983","Jones v. Barnes, 463 U.S. 745 (1983)","1982 J. Sup. Ct. U.S. 414","aka Sheila Ginsberg Riesel"
448,204,"Carolyn M. Snurkowski","",false,1,"Feb. 23, 1983","Florida v. Casal, 462 U.S. 637 (1983)","1982 J. Sup. Ct. U.S. 417",""
449,205,"Linda Gillespie Stuntz","",false,1,"Mar. 1, 1983","Tuten v. United States, 460 U.S. 660 (1983)","1982 J. Sup. Ct. U.S. 437",""
450,176,"Barbara E. Etkind","",false,7,"Mar. 1, 1983","Tuten v. United States, 460 U.S. 660 (1983)","1982 J. Sup. Ct. U.S. 437",""
451,206,"Suellen L. Davidson","",false,1,"Mar. 21, 1983","Brown v. Thomson, 462 U.S. 835 (1983)","1982 J. Sup. Ct. U.S. 481",""
452,207,"Amy Jo Gittler","",false,1,"Mar. 28, 1983","Arizona Governing Committee for Tax Deferred Annuity v. Norris, 463 U.S. 1073 (1983)","1982 J. Sup. Ct. U.S. 498",""
453,201,"Carolyn F. Corwin","",false,2,"Mar. 29, 1983","Bill Johnson's Restaurants v. NLRB, 461 U.S. 731 (1983)","1982 J. Sup. Ct. U.S. 500",""
454,208,"Charlotte Uram","",false,1,"Mar. 30, 1983","Texas v. New Mexico, 462 U.S. 554 (1983)","1982 J. Sup. Ct. U.S. 501",""
455,209,"Margaret Hunting","",false,1,"Apr. 18, 1983","Bell v. New Jersey, 461 U.S. 773 (1983)","1982 J. Sup. Ct. U.S. 548",""
456,210,"Patti S. Kitching","",false,1,"Apr. 19, 1983","Franchise Tax Board of California v. United States Postal Service, 463 U.S. 1 (1983)","1982 J. Sup. Ct. U.S. 552",""
457,159,"Kathryn A. Oberly","",false,2,"Apr. 25, 1983","Ruckelshaus v. Sierra Club, 464 U.S. 680 (1983)","1982 J. Sup. Ct. U.S. 569",""
458,211,"Susan Short","",false,1,"Apr. 27, 1983","Pickett v. Brown, 462 U.S. 1 (1983)","1982 J. Sup. Ct. U.S. 573",""
459,96,"Harriet S. Shapiro","",false,15,"Apr. 27, 1983","Newport News Shipbuilding & Dry Dock Co. v. EEOC, 462 U.S. 669 (1983)","1982 J. Sup. Ct. U.S. 773",""
460,212,"Susan Lee Voss","",false,1,"Oct. 5, 1983","South Carolina v. Regan, 465 U.S. 367 (1984)","1983 J. Sup. Ct. U.S. 83",""
461,213,"Janice M. Joyce Bartee","",false,1,"Oct. 5, 1983","Michigan v. Clifford, 464 U.S. 287 (1984)","1983 J. Sup. Ct. U.S. 83",""
462,201,"Carolyn F. Corwin","",false,3,"Oct. 11, 1983","Bureau of Alcohol, Tobacco & Firearms v. Federal Labor Relations Authority, 464 U.S. 89 (1983)","1983 J. Sup. Ct. U.S. 106",""
463,214,"Ruth E. Peters","",false,1,"Oct. 11, 1983","Bureau of Alcohol, Tobacco & Firearms v. Federal Labor Relations Authority, 464 U.S. 89 (1983)","1983 J. Sup. Ct. U.S. 106",""
464,215,"Diana Gribbon Motz","",false,1,"Oct. 31, 1983","Secretary of State of Maryland v. Joseph H. Munson Company, Inc., 467 U.S. 947 (1984)","1983 J. Sup. Ct. U.S. 152",""
465,176,"Barbara E. Etkind","",false,8,"Oct. 31, 1983","McCain v. Lybrand, 465 U.S. 236 (1984)","1983 J. Sup. Ct. U.S. 153",""
466,216,"Karen LeCraft Henderson","",false,1,"Oct. 31, 1983","McCain v. Lybrand, 465 U.S. 236 (1984)","1983 J. Sup. Ct. U.S. 153",""
467,217,"Theodora Berger","",false,1,"Nov. 1, 1983","Secretary of Interior v. California, 464 U.S. 312 (1984)","1983 J. Sup. Ct. U.S. 156",""
468,218,"Deborah C. Wyatt","",false,1,"Nov. 2, 1983","Pulliam v. Allen, 466 U.S. 522 (1984)","1983 J. Sup. Ct. U.S. 157",""
469,159,"Kathryn A. Oberly","",false,3,"Nov. 7, 1983","Kosak v. United States, 465 U.S. 848 (1984)","1983 J. Sup. Ct. U.S. 173",""
470,219,"Donna L. Zeegers","",false,1,"Nov. 9, 1983","Oliver v. United States, 466 U.S. 170 (1984)","1983 J. Sup. Ct. U.S. 177",""
471,220,"Leslie A. Benitez","",false,1,"Nov. 9, 1973","McKaskle v. Wiggins, 465 U.S. (1984)","1983 J. Sup. Ct. U.S. 177",""
472,116,"Barbara A.H. Smith","",false,4,"Dec. 6, 1983","Justices of Boston Municipal Court v. Lydon, 466 U.S. 294 (1984)","1983 J. Sup. Ct. U.S. 243",""
473,221,"Ann L. Ritter","",false,1,"Dec. 6, 1983","INS v Stevic, 467 U.S. 407 (1984)","1983 J. Sup. Ct. U.S. 243",""
474,218,"Deborah C. Wyatt","",false,2,"Dec. 7, 1983","Hudson v. Palmer, 468 U.S. 517 (1984)","1983 J. Sup. Ct. U.S. 245","originally listed as new advocate; actually her 2nd argument"
475,222,"Arlinda F. Locklear","",false,1,"Dec. 7, 1983","Solem v. Bartlett, 465 U.S. 463 (1984)","1983 J. Sup. Ct. U.S. 245",""
476,204,"Carolyn M. Snurkowski","",false,2,"Jan. 10, 1984","Strickland v. Washington, 466 U.S. 668 (1984)","1983 J. Sup. Ct. U.S. 302",""
477,116,"Barbara A.H. Smith","",false,5,"Jan. 17, 1984","Massachusetts v. Sheppard, 468 U.S. 981 (1984)","1983 J. Sup. Ct. U.S. 320",""
478,112,"Judith A. Gordon","",false,6,"Jan. 17, 1984","Schall v. Martin, 467 U.S. 253 (1984)","1983 J. Sup. Ct. U.S. 320",""
479,159,"Kathryn A. Oberly","",false,4,"Jan. 17, 1984","Nix v. Williams, 467 U.S. 431 (1984)","1983 J. Sup. Ct. U.S. 322",""
480,223,"Ann E. Keating","",false,1,"Feb. 21, 1984","Hayfield Northern Railroad Co., Inc. v. N. W. Transportation s Co., 467 U.S. 622 (1984)","1983 J. Sup. Ct. U.S. 387",""
481,96,"Harriet S. Shapiro","",false,16,"Feb. 22, 1984","Kirby Forest Industries, Inc. v. United States, 467 U.S. 1 (1984)","1983 J. Sup. Ct. U.S. 390",""
482,224,"Penny R. Warren","",false,1,"Feb. 28, 1984","James v. Kentucky, 466 U.S. 341 (1984)","1983 J. Sup. Ct. U.S. 408",""
483,225,"Nancy Alvarado Saggese","",false,1,"Feb. 29, 1984","Summa Corporation v. California, 466 U.S. 198 (1984)","1983 J. Sup. Ct. U.S. 409",""
484,159,"Kathryn A. Oberly","",false,5,"Feb. 29, 1984","South Central Timber Development, Inc. v. Wunnicke, 467 U.S. (1984)","1983 J. Sup. Ct. U.S. 410",""
485,96,"Harriet S. Shapiro","",false,17,"Mar. 19, 1984","Cooper v. Federal Reserve Bank of Richmond, 467 U.S. 867 (1984)","1983 J. Sup. Ct. U.S. 458",""
486,201,"Carolyn F. Corwin","",false,4,"Mar. 27, 1984","United States v. Yermiam, 468 U.S. 63 (1984)","1983 J. Sup. Ct. U.S. 478",""
487,176,"Barbara E. Etkind","",false,9,"Mar. 27, 1984","United States v. Rodgers, 466 U.S. 475 (1984)","1983 J. Sup. Ct. U.S. 478",""
488,226,"Mary Beth Westmoreland","",false,1,"Mar. 27, 1984","Waller v. Georgia, 467 U.S. 39 (1984)","1983 J. Sup. Ct. U.S. 478",""
489,227,"Lois DeJulio","",false,1,"Mar. 28, 1984","New Jersey v. T.L.O., 469 U.S. 325 (1985)","1983 J. Sup. Ct. U.S. 479",""
490,228,"Mary F. Keiler","",false,1,"Mar. 28, 1984","Bernal v. Fainter, 467 U.S. 216 (1984)","1983 J. Sup. Ct. U.S. 479",""
491,210,"Patti S. Kitching","",false,2,"Apr. 17, 1984","Franchise Tax Board of California v. United States Postal Service, 467 U.S. 512 (1984)","1983 J. Sup. Ct. U.S. 526",""
492,229,"Mary L. Heen","",false,1,"Apr. 18, 1984","INS v. Lopez-Mendoza, 468 U.S. 1032 (1984)","1983 J. Sup. Ct. U.S. 528",""
493,201,"Carolyn F. Corwin","",false,5,"Apr. 23, 1984","United States v. Lorenzetti, 467 U.S. 167 (1984)","1983 J. Sup. Ct. U.S. 542",""
494,159,"Kathryn A. Oberly","",false,6,"Apr. 24, 1984","Block v. Community Nutrition Institute, 467 U.S. 340 (1984)","1983 J. Sup. Ct. U.S. 543",""
495,230,"Kaletah N. Carroll","",false,1,"Apr. 25, 1984","United States v. Morton, 467 U.S. 822 (1984)","1983 J. Sup. Ct. U.S. 546",""
496,222,"Arlinda F. Locklear","",false,2,"Oct. 1, 1984","Oneida County v. Oneida Ind. Nation, 470 U.S. 226 (1985)","1984 J. Sup. Ct. U.S. 87-88",""
497,227,"Lois DeJulio","",false,2,"Oct. 2, 1984","New Jersey v. T.L.O., 469 U.S. 325 (1985)","1984 J. Sup. Ct. U.S. 89",""
498,201,"Carolyn F. Corwin","",false,6,"Oct. 3, 1984","Herb's Welding v. Gray, 470 U.S. 414 (1985)","1984 J. Sup. Ct. U.S. 91",""
499,159,"Kathryn A. Oberly","",false,7,"Oct. 10, 1984","Ohio v. Kovacs, 469 U.S. 274 (1985)","1984 J. Sup. Ct. U.S. 115",""
500,231,"Grace E. Evans","",false,1,"Oct. 30, 1984","First National Bank of Atlanta v, Bartow County Board of Tax Assessors, 470 U.S. 583 (1985)","1984 J. Sup. Ct. U.S. 171",""
