oyezId,volume,page,year,caseTitle,oldCite,usCite,dateDecision,docket,term,termId,issue,datesArgued,daysArgument,votesPetitioner,votesRespondent,advocateName,advocateRole,pdfSource,urlOyez
51077,417,134,1974,Commissioner of Internal Revenue v. National Alfalfa Dehydrating & Milling Company,0,417 U.S. 134,1974-05-28,73-9,1973,1973-10,"federal taxation, typically under provisions of the Internal Revenue Code",1974-01-14,1,9,0,Stuart A. Smith,0,loc,"https://www.oyez.org/cases/1973/73-9"
51073,417,673,1974,Central Tablet Mfg. Company v. United States,0,417 U.S. 673,1974-06-19,73-593,1973,1973-10,"federal taxation, typically under provisions of the Internal Revenue Code","1974-03-25,1974-03-26",2,4,5,Stuart A. Smith,0,loc,"https://www.oyez.org/cases/1973/73-593"
51137,416,500,1974,Snow v. Commissioner of Internal Revenue,0,416 U.S. 500,1974-05-13,73-641,1973,1973-10,"federal taxation, typically under provisions of the Internal Revenue Code",1974-04-16,1,8,0,Stuart A. Smith,0,loc,"https://www.oyez.org/cases/1973/73-641"
51200,420,141,1975,United States v. Bisceglia,0,420 U.S. 141,1975-02-19,73-1245,1974,1974-10,"federal taxation, typically under provisions of the Internal Revenue Code","1974-11-11,1974-11-12",2,7,2,Stuart A. Smith,0,loc,"https://www.oyez.org/cases/1974/73-1245"
51324,423,161,1976,Laing v. United States,0,423 U.S. 161,1976-01-13,73-1808,1974,1974-10,"due process: hearing or notice (other than as pertains to government employees or prisoners' rights)","1975-01-21,1975-10-15",2,5,3,Stuart A. Smith,0,loc,"https://www.oyez.org/cases/1974/73-1808"
51219,421,599,1975,United States v. Tax Commission of Mississippi,0,421 U.S. 599,1975-06-02,74-548,1974,1974-10,"national supremacy: intergovernmental tax immunity",1975-04-22,1,7,2,Stuart A. Smith,0,loc,"https://www.oyez.org/cases/1974/74-548"
51494,429,32,1976,"United States v. Foster Lumber Company, Inc.",0,429 U.S. 32,1976-11-02,74-799,1975,1975-10,"federal taxation, typically under provisions of the Internal Revenue Code","1975-11-12,1976-10-05",2,5,4,Stuart A. Smith,0,loc,"https://www.oyez.org/cases/1975/74-799"
51435,426,26,1976,Simon v. Eastern Kentucky Welfare Rights Organization,0,426 U.S. 26,1976-06-01,74-1124,1975,1975-10,"standing to sue: direct injury",1975-12-10,1,8,0,Stuart A. Smith,0,loc,"https://www.oyez.org/cases/1975/74-1124"
51532,430,725,1977,United States v. Consumer Life Insurance Company,0,430 U.S. 725,1977-04-26,75-1221,1976,1976-10,"federal taxation, typically under provisions of the Internal Revenue Code",1976-12-06,1,2,7,Stuart A. Smith,0,loc,"https://www.oyez.org/cases/1976/75-1221"
51619,433,148,1977,Commissioner v. Standard Life & Accident Ins. Company,0,433 U.S. 148,1977-06-23,75-1771,1976,1976-10,"federal taxation, typically under provisions of the Internal Revenue Code",1977-03-30,1,8,0,Stuart A. Smith,0,loc,"https://www.oyez.org/cases/1976/75-1771"
51867,435,21,1978,Central Illinois Public Service Company v. United States,0,435 U.S. 21,1978-02-28,76-1058,1977,1977-10,"federal taxation of gifts, personal, business, or professional expenses",1977-10-12,1,9,0,Stuart A. Smith,0,loc,"https://www.oyez.org/cases/1977/76-1058"
51810,434,77,1977,Commissioner of Internal Revenue v. Kowalski,0,434 U.S. 77,1977-11-29,76-1095,1977,1977-10,"federal taxation of gifts, personal, business, or professional expenses",1977-10-12,1,7,2,Stuart A. Smith,0,loc,"https://www.oyez.org/cases/1977/76-1095"
51859,435,561,1978,Frank Lyon Company v. United States,0,435 U.S. 561,1978-04-18,76-624,1977,1977-10,"federal taxation, typically under provisions of the Internal Revenue Code",1977-11-02,1,7,2,Stuart A. Smith,0,loc,"https://www.oyez.org/cases/1977/76-624"
51722,436,268,1978,United States v. Sotelo,0,436 U.S. 268,1978-05-22,76-1800,1977,1977-10,"priority of federal fiscal claims: over those of the states or private entities",1978-02-22,1,5,4,Stuart A. Smith,0,loc,"https://www.oyez.org/cases/1977/76-1800"
52009,439,522,1979,Thor Power Tool v. Commissioner of Internal Revenue,0,439 U.S. 522,1979-01-16,77-920,1978,1978-10,"federal taxation, typically under provisions of the Internal Revenue Code",1978-11-01,1,0,9,Stuart A. Smith,0,loc,"https://www.oyez.org/cases/1978/77-920"
51909,440,472,1979,"National Muffler Dealers Assn., Inc. v. United States",0,440 U.S. 472,1979-03-20,77-1172,1978,1978-10,"federal taxation, typically under provisions of the Internal Revenue Code",1978-11-27,1,3,6,Stuart A. Smith,0,loc,"https://www.oyez.org/cases/1978/77-1172"
52030,440,147,1979,Montana v. United States,0,440 U.S. 147,1979-02-22,77-1134,1978,1978-10,state or local government tax,1978-12-04,1,8,1,Stuart A. Smith,0,loc,"https://www.oyez.org/cases/1978/77-1134"
52197,444,707,1980,United States v. Euge,0,444 U.S. 707,1980-02-20,78-1453,1979,1979-10,self-incrimination (other than as pertains to Miranda or immunity from prosecution),1979-11-26,1,6,3,Stuart A. Smith,0,loc,"https://www.oyez.org/cases/1979/78-1453"
52200,444,555,1980,Ford Motor Credit Company v. Milhollin,0,444 U.S. 555,1980-02-20,78-1487,1979,1979-10,"federal or state consumer protection: typically under the Truth in Lending; Food, Drug and Cosmetic; and Consumer Protection Credit Acts",1979-12-04,1,9,0,Stuart A. Smith,0,loc,"https://www.oyez.org/cases/1979/78-1487"
52205,445,715,1980,Andrus v. Idaho,0,445 U.S. 715,1980-04-16,79-260,1979,1979-10,"natural resources - environmental protection (cf. national supremacy: natural resources, national supremacy: pollution)",1980-02-25,1,8,0,Stuart A. Smith,0,loc,"https://www.oyez.org/cases/1979/79-260"
52256,451,571,1981,United States v. Swank,0,451 U.S. 571,1981-05-18,79-1515,1980,1980-10,"federal taxation, typically under provisions of the Internal Revenue Code",1980-12-09,1,2,7,Stuart A. Smith,0,loc,"https://www.oyez.org/cases/1980/79-1515"
52305,450,156,1981,Commissioner of Internal Revenue v. Portland Cement Company of Utah,0,450 U.S. 156,1981-03-03,79-1907,1980,1980-10,"federal taxation, typically under provisions of the Internal Revenue Code",1981-01-13,1,9,0,Stuart A. Smith,0,loc,"https://www.oyez.org/cases/1980/79-1907"
52318,451,725,1981,Maryland v. Louisiana,0,451 U.S. 725,1981-05-26,83 Orig.,1980,1980-10,state or local government tax,1981-01-19,1,7,1,Stuart A. Smith,0,loc,"https://www.oyez.org/cases/1980/83_orig"
52365,452,247,1981,"Rowan Cos., Inc. v. United States",0,452 U.S. 247,1981-06-08,80-780,1980,1980-10,"federal taxation, typically under provisions of the Internal Revenue Code",1981-04-21,1,6,3,Stuart A. Smith,0,loc,"https://www.oyez.org/cases/1980/80-780"
52563,455,16,1982,United States v. Vogel Fertilizer Company,0,455 U.S. 16,1982-01-13,80-1251,1981,1981-10,"federal taxation, typically under provisions of the Internal Revenue Code",1981-11-03,1,2,7,Stuart A. Smith,0,loc,"https://www.oyez.org/cases/1981/80-1251"
52527,455,305,1982,Jewett v. Commissioner,0,455 U.S. 305,1982-02-23,80-1614,1981,1981-10,"federal taxation of gifts, personal, business, or professional expenses",1981-12-01,1,3,6,Stuart A. Smith,0,loc,"https://www.oyez.org/cases/1981/80-1614"
52512,457,191,1982,Diedrich v. Commissioner,0,457 U.S. 191,1982-06-15,80-2204,1981,1981-10,"federal taxation of gifts, personal, business, or professional expenses",1982-02-24,1,1,8,Stuart A. Smith,0,loc,"https://www.oyez.org/cases/1981/80-2204"
52432,463,1220,1983,Chicago Bridge & Iron Company v. Caterpillar Tractor Co.,0,463 U.S. 1220,1983-07-06,81-349,1981,1981-10,0,1982-04-19,1,0,0,Stuart A. Smith,0,loc,"https://www.oyez.org/cases/1981/81-349"
52653,461,300,1983,Commissioner v. Tufts,0,461 U.S. 300,1983-05-02,81-1536,1982,1982-10,"federal taxation, typically under provisions of the Internal Revenue Code",1982-11-29,1,9,0,Stuart A. Smith,0,loc,"https://www.oyez.org/cases/1982/81-1536"
52723,460,536,1983,Washington v. United States,0,460 U.S. 536,1983-03-29,81-969,1982,1982-10,state or local government tax,1983-01-10,1,5,4,Stuart A. Smith,0,loc,"https://www.oyez.org/cases/1982/81-969"
52607,462,198,1983,"United States v. Whiting Pools, Inc.",0,462 U.S. 198,1983-06-08,82-215,1982,1982-10,bankruptcy (except in the context of priority of federal fiscal claims),1983-04-19,1,0,9,Stuart A. Smith,0,loc,"https://www.oyez.org/cases/1982/82-215"
