oyezId,volume,page,year,caseTitle,oldCite,usCite,dateDecision,docket,term,termId,issue,datesArgued,daysArgument,votesPetitioner,votesRespondent,advocateName,advocateRole,pdfSource,urlOyez
"51614",431,606,1977,"United States v. Ramsey","","431 U.S. 606","1977-06-06","76-167","1976","1976-10","search and seizure (other than as pertains to vehicles or Crime Control Act)","1977-03-30",1,6,3,"Kenneth Steven Geller","","loc","https://www.oyez.org/cases/1976/76-167"
"51575",433,119,1977,"Jones v. North Carolina Prisoners' Labor Union, Inc.","","433 U.S. 119","1977-06-23","75-1874","1976","1976-10","First Amendment, miscellaneous (cf. comity: First Amendment)","1977-04-19",1,7,2,"Kenneth Steven Geller","","loc","https://www.oyez.org/cases/1976/75-1874"
"51708",434,28,1978,"Crist, et al. v. Cline & Brest","","434 U.S. 28","1978-06-14","76-1200","1977","1977-10","double jeopardy","1977-11-01,1978-03-22",2,3,6,"Kenneth Steven Geller","","loc","https://www.oyez.org/cases/1977/76-1200"
"51837",435,850,1978,"United States v. MacDonald","","435 U.S. 850","1978-05-01","75-1892","1977","1977-10","speedy trial","1978-01-09",1,8,0,"Kenneth Steven Geller","","loc","https://www.oyez.org/cases/1977/75-1892"
"51984",443,340,1979,"Federal Open Market Committee of the Federal Reserve System v. Merrill","","443 U.S. 340","1979-06-27","77-1387","1978","1978-10","Freedom of Information Act and related federal or state statutes or regulations","1978-12-06",1,7,2,"Kenneth Steven Geller","","loc","https://www.oyez.org/cases/1978/77-1387"
"51895",440,741,1979,"United States v. Caceres","","440 U.S. 741","1979-04-02","76-1309","1978","1978-10","search and seizure (other than as pertains to vehicles or Crime Control Act)","1979-01-08,1979-01-09",2,7,2,"Kenneth Steven Geller","","loc","https://www.oyez.org/cases/1978/76-1309"
"52000",441,780,1979,"United States v. Timmreck","","441 U.S. 780","1979-05-21","78-744","1978","1978-10","Federal Rules of Criminal Procedure","1979-04-16",1,9,0,"Kenneth Steven Geller","","loc","https://www.oyez.org/cases/1978/78-744"
"52053",445,169,1980,"Forsham v. Harris","","445 U.S. 169","1980-03-03","78-1118","1979","1979-10","Freedom of Information Act and related federal or state statutes or regulations","1979-10-31",1,2,7,"Kenneth Steven Geller","","loc","https://www.oyez.org/cases/1979/78-1118"
"52061",445,375,1980,"GTE Sylvania, Inc. v. Consumers Union of the United States, Inc.","","445 U.S. 375","1980-03-19","78-1248","1979","1979-10","Freedom of Information Act and related federal or state statutes or regulations","1979-11-28",1,9,0,"Kenneth Steven Geller","","loc","https://www.oyez.org/cases/1979/78-1248"
"52063",446,14,1980,"Carlson, v. Green","","446 U.S. 14","1980-04-22","78-1261","1979","1979-10","liability, governmental: tort or contract actions by or against government or governmental officials other than defense of criminal actions brought under a civil rights action.","1980-01-07",1,2,7,"Kenneth Steven Geller","","loc","https://www.oyez.org/cases/1979/78-1261"
"52059",446,238,1980,"Marshall v. Jerrico, Inc.","","446 U.S. 238","1980-04-28","79-253","1979","1979-10","due process: impartial decision maker","1980-03-19",1,9,0,"Kenneth Steven Geller","","loc","https://www.oyez.org/cases/1979/79-253"
"52294",449,200,1980,"United States v. Will","","449 U.S. 200","1980-12-15","79-983","1980","1980-10","miscellaneous","1980-10-14",1,8,0,"Kenneth Steven Geller","","loc","https://www.oyez.org/cases/1980/79-983"
"52268",452,490,1981,"American Textile Mfrs. Institute, Inc. v. Donovan","","452 U.S. 490","1981-06-17","79-1429","1980","1980-10","Occupational Safety and Health Act","1981-01-21",1,5,3,"Kenneth Steven Geller","","loc","https://www.oyez.org/cases/1980/79-1429"
"52353",452,594,1981,"Donovan v. Dewey","","452 U.S. 594","1981-06-17","80-901","1980","1980-10","search and seizure (other than as pertains to vehicles or Crime Control Act)","1981-04-28",1,8,1,"Kenneth Steven Geller","","loc","https://www.oyez.org/cases/1980/80-901"
"52546",458,591,1982,"Velde v. National Black Police Assn., Inc.","","458 U.S. 591","1982-06-30","80-1074","1981","1981-10","liability, governmental: tort or contract actions by or against government or governmental officials other than defense of criminal actions brought under a civil rights action.","1981-12-09",1,7,0,"Kenneth Steven Geller","","loc","https://www.oyez.org/cases/1981/80-1074"
"52460",456,615,1982,"Federal Bureau of Investigation v. Abramson","","456 U.S. 615","1982-05-24","80-1735","1981","1981-10","Freedom of Information Act and related federal or state statutes or regulations","1982-01-11",1,5,4,"Kenneth Steven Geller","","loc","https://www.oyez.org/cases/1981/80-1735"
"52510",456,188,1982,"Schweiker v. McClure","","456 U.S. 188","1982-04-20","81-212","1981","1981-10","due process: impartial decision maker","1982-03-01",1,9,0,"Kenneth Steven Geller","","loc","https://www.oyez.org/cases/1981/81-212"
"52513",456,595,1982,"United States Department of State v. Washington Post Company","","456 U.S. 595","1982-05-17","81-535","1981","1981-10","Freedom of Information Act and related federal or state statutes or regulations","1982-03-31",1,9,0,"Kenneth Steven Geller","","loc","https://www.oyez.org/cases/1981/81-535"
"52591",460,103,1983,"Dickerson v. New Banner Institute, Inc.","","460 U.S. 103","1983-02-23","81-1180","1982","1982-10","statutory construction of criminal laws: firearms","1982-11-29",1,5,4,"Kenneth Steven Geller","","loc","https://www.oyez.org/cases/1982/81-1180"
"52745",462,367,1983,"Bush v. Lucas","","462 U.S. 367","1983-06-13","81-469","1982","1982-10","liability, governmental: tort or contract actions by or against government or governmental officials other than defense of criminal actions brought under a civil rights action.","1983-01-19",1,0,9,"Kenneth Steven Geller","","loc","https://www.oyez.org/cases/1982/81-469"
"52593",462,19,1983,"Federal Trade Commission v. Grolier, Inc.","","462 U.S. 19","1983-06-06","82-372","1982","1982-10","Freedom of Information Act and related federal or state statutes or regulations","1983-03-29",1,9,0,"Kenneth Steven Geller","","loc","https://www.oyez.org/cases/1982/82-372"
"52645",461,773,1983,"Bell v. New Jersey","","461 U.S. 773","1983-05-31","81-2125","1982","1982-10","miscellaneous federalism","1983-04-18",1,9,0,"Kenneth Steven Geller","","loc","https://www.oyez.org/cases/1982/81-2125"
"52754",464,154,1984,"United States v. Mendoza","","464 U.S. 154","1984-01-10","82-849","1983","1983-10","judicial administration: collateral estoppel or res judicata","1983-11-02",1,9,0,"Kenneth Steven Geller","","loc","https://www.oyez.org/cases/1983/82-849"
"52816",467,407,1984,"Immigration and Naturalization Service v. Stevic","","467 U.S. 407","1984-06-05","82-973","1983","1983-10","deportation (cf. immigration and naturalization)","1983-12-06",1,9,0,"Kenneth Steven Geller","","loc","https://www.oyez.org/cases/1983/82-973"
"52818",467,797,1984,"United States v. S.A. Empressa de Viacao Aerea Rio Grandense (Varig Airlines)","","467 U.S. 797","1984-06-19","82-1349","1983","1983-10","liability, governmental: tort or contract actions by or against government or governmental officials other than defense of criminal actions brought under a civil rights action.","1984-01-18",1,9,0,"Kenneth Steven Geller","","loc","https://www.oyez.org/cases/1983/82-1349"
"52805",467,51,1984,"Heckler v. Community Health Services of Crawford Cty., Inc.","","467 U.S. 51","1984-05-21","83-56","1983","1983-10","poverty law, statutory: welfare benefits, typically under some Social Security Act provision.","1984-02-27",1,9,0,"Kenneth Steven Geller","","loc","https://www.oyez.org/cases/1983/83-56"
"52798",467,735,1984,"Securities and Exchange Commission v. Jerry T. O'Brien, Inc.","","467 U.S. 735","1984-06-18","83-751","1983","1983-10","federal or state regulation of securities","1984-04-17",1,9,0,"Kenneth Steven Geller","","loc","https://www.oyez.org/cases/1983/83-751"
"52979",470,821,1985,"Heckler v. Chaney","","470 U.S. 821","1985-03-20","83-1878","1984","1984-10","judicial review of administrative agency's or administrative official's actions and procedures","1984-12-03",1,9,0,"Kenneth Steven Geller","","loc","https://www.oyez.org/cases/1984/83-1878"
"53085",470,656,1985,"Bennett v. Kentucky Department of Education","","470 U.S. 656","1985-03-19","83-1798","1984","1984-10","miscellaneous federalism","1985-01-08",1,8,0,"Kenneth Steven Geller","","loc","https://www.oyez.org/cases/1984/83-1798"
"52985",473,52,1985,"United States v. Shearer","","473 U.S. 52","1985-06-27","84-194","1984","1984-10","liability, governmental: tort or contract actions by or against government or governmental officials other than defense of criminal actions brought under a civil rights action.","1985-02-25",1,8,0,"Kenneth Steven Geller","","loc","https://www.oyez.org/cases/1984/84-194"
"53128",474,193,1985,"Cleavinger v. Saxner","","474 U.S. 193","1985-12-10","84-732","1985","1985-10","liability, governmental: tort or contract actions by or against government or governmental officials other than defense of criminal actions brought under a civil rights action.","1985-10-16",1,3,6,"Kenneth Steven Geller","","loc","https://www.oyez.org/cases/1985/84-732"
"53233",476,693,1986,"Bowen v. Roy","","476 U.S. 693","1986-06-11","84-780","1985","1985-10","free exercise of religion","1986-01-14",1,8,1,"Kenneth Steven Geller","","loc","https://www.oyez.org/cases/1985/84-780"
"53629",488,19,1988,"Shell Oil Company v. Iowa Department of Revenue","","488 U.S. 19","1988-11-08","87-984","1988","1988-10","federal pre-emption of state legislation or regulation. cf. state regulation of business. rarely involves union activity. Does not involve constitutional interpretation unless the Court says it does.","1988-10-04",1,0,9,"Kenneth Steven Geller","","loc","https://www.oyez.org/cases/1988/87-984"
"53953",503,181,1992,"General Motors Corporation v. Romein","","503 U.S. 181","1992-03-09","90-1390","1991","1991-10","state or local government regulation, especially of business (cf. federal pre-emption of state court jurisdiction, federal pre-emption of state legislation or regulation)","1991-12-10",1,0,9,"Kenneth Steven Geller","","loc","https://www.oyez.org/cases/1991/90-1390"
"54546",519,61,1996,"Caterpillar Inc. v. Lewis","","519 U.S. 61","1996-12-10","95-1263","1996","1996-10","judicial administration: jurisdiction or authority of federal district courts or territorial courts","1996-11-12",1,9,0,"Kenneth Steven Geller","","loc","https://www.oyez.org/cases/1996/95-1263"
"54665",523,1114,1998,"Lewis, Deceased v. Brunswick Corporation","","523 U.S. 1114","1998-05-15","97-288","1997","1997-10","","1998-03-02",1,0,9,"Kenneth Steven Geller","","loc","https://www.oyez.org/cases/1997/97-288"
"54662",524,51,1998,"United States v. Bestfoods","","524 U.S. 51","1998-06-08","97-454","1997","1997-10","natural resources - environmental protection (cf. national supremacy: natural resources, national supremacy: pollution)","1998-03-24",1,9,0,"Kenneth Steven Geller","","loc","https://www.oyez.org/cases/1997/97-454"
"54875",531,341,2001,"Buckman Company v. Plaintiffs' Legal Committee","","531 U.S. 341","2001-02-21","98-1768","2000","2000-10","federal pre-emption of state legislation or regulation. cf. state regulation of business. rarely involves union activity. Does not involve constitutional interpretation unless the Court says it does.","2000-12-04",1,9,0,"Kenneth Steven Geller","","loc","https://www.oyez.org/cases/2000/98-1768"
"55069",537,437,2003,"Boeing Company v. United States","","537 U.S. 437","2003-03-04","01-1209","2002","2002-10","federal taxation, typically under provisions of the Internal Revenue Code","2002-12-09",1,2,7,"Kenneth Steven Geller","","loc","https://www.oyez.org/cases/2002/01-1209"
"55053",538,803,2003,"National Park Hospitality Assn. v. Dept. of the Interior","","538 U.S. 803","2003-05-27","02-196","2002","2002-10","standing to sue: justiciable question","2003-03-04",1,2,7,"Kenneth Steven Geller","","loc","https://www.oyez.org/cases/2002/02-196"
"55085",539,396,2003,"American Insurance Ass'n v. Garamendi","","539 U.S. 396","2003-06-23","02-722","2002","2002-10","federal pre-emption of state legislation or regulation. cf. state regulation of business. rarely involves union activity. Does not involve constitutional interpretation unless the Court says it does.","2003-04-23",1,5,4,"Kenneth Steven Geller","","loc","https://www.oyez.org/cases/2002/02-722"
